{
  "conditions_revision": "2026-10-29T13:02:32Z",
  "generated_at": "2026-10-29T13:04:17Z",
  "media_revision": "sha256:135b07b7e874240448d932603b674f803e5d851cf554da334ddf4fad88f69c51",
  "revision": "sha256:c6b7c323a09c221ecb01a2d4e62cdd2685a1738dbc3c63997b94592857524c6a",
  "schema_version": 1
}
